id,content,year
336,"The Meduna River is one of several in Northeastern Italy referred to as “gravel rivers” because of the large amount of sediment let loose by upstream mountain basin seismic activity. These rivers have braided channels and are becoming prone to flooding__no.0336, 2019.  #Europe #gravelrivers",2019
337,"Erdine River Basin in Turkey’s Erdine Province where a Turkish scientist got a 15-month sentence for publishing an environmental study on the state of the heavily polluted river__no.0337, 2019.  #MiddleEast #riverpollution #waterpollution #freedomofspeech #activism #environentalreporting ",2019
338,"The Black River meets the Cape Fear River in North Carolina. Further upstream the swampy Black River Preserve is home to the 5th oldest tree in the world, a bald cypress__no.0338, 2019. #swamp #Eastcoast",2019
339,"In Maryland’s Blackwater National Wildlife Refuge, rising sea levels are causing “ghost forests” as ground is too wet and too salty to support living trees. —Oct, 2019, Time Magazine__no.0339, 2019. #Maryland #Eastcoast #risingwaters #saltwater #climatechange #sealevelrise #ghostforests",2019
340,"The lower Potomac River, after almost 50 years of pollution control, clean-up and restoration efforts, has seen over 1,000 dophins living, mating and even giving birth, according to researchers. Smithsonian, October, 2019.__no.0340, 2019. #pollutioncontrol #riverrestoration #riverrevival #Eastcoast",2019
341,"Ginnie Springs, near the Santa Fe River, and north of Gainesville, Florida. The Suwannee River Water Management District Board, based in Lake City, FL, is scheduled to vote on a request for a permit to extract more than a million gallons of fresh water a day for the next 20 years from Ginnie Springs. Application is from Seven River Springs which appears to supply water to Swiss conglomerate Nestle. August 2019.__no.0341, 2019. #waterextraction #freshwatersupply #NestleCompany #springwaterextraction",2019
342,"On the eastern shores of the Bering Sea, in the Unalakleet River at Unalakleet, Alaska, pink salmon are found dead due to the temperatures into the low 90’s. July, 2019.__no.0342, 2019.  #risingtemperatures",2019
343,"Unalakleet River Delta at Unalakleet, Alaska__no.0343, 2019.",2019
344,"In September, 2019, people in Switzerland marked the disappearance of the Pizol Glacier with a sign as a way of dealing with their grief__no.0344, 2019. #Europe #grief",2019
345,"Lower Colorado River at the U.S. California/Arizona border. Drought conditions plus population growth inspire the seven states which rely on the over-allocated river to use all available conservation measures__no.0345, 2019. #Southwest #waterconservation #waterallocation",2019
346,"The Euphrates River in Syria, approximately 6 miles south of Turkey’s border and north of the city of Manbij where a U.S. military base was abandoned in October, 2019.__no.0346, 2019.  ",2019
347,"The Tigris River at Baghdad, Iraq…The entire river had decreasing water levels over many years until in April, 2019, rains brought historic high water levels to Iraq reservoirs__no.0347, 2019.",2019
348,"Confluence of the Sai and Chikuma Rivers in Nagano, Japan, where intense rainfall and serious flooding from 2019’s Typhoon Hagibis left 10 bullet trains sitting in a pool of water__no.0348, 2019. #bullettrains #Asia ",2019
349,"The Dnieper River at Kiev, Ukraine, flows from glaciers in central Russia__no.0349, 2019. #DnieperRiver",2019
350,"The Kitimat River, at Kitimat, British Columbia in Canada, is named after First Nations inhabitants of the river valley, the Gitamaat, and means “People of the Falling Snow.”__no.0350, 2019. #Canada #FirstNationspeoples",2019
351,"The Columbia River at Chief Joseph Dam in Bridgeport, Washington, is the second largest hydropower producing dam in the U.S…Because of the lack of fish ladders, the dam completely blocks salmon migrating to the upper Columbia’s river system__no.0351, 2019. #dams #damn",2019
352,"Turneffe Atoll, within Belize’s protected marine area, is the largest and most biologically diverse atoll in the Americas, alive with coral, fish, and large rays (“atoll” : a ring-shaped reef, island, or chain of islands formed of coral.)i__no.0352, 2019. #Belize #biodiversity #marinelife #CentralAmerica #Caribbean",2019
353,"South of San Lorenzo, Honduras, a large and rich nature preserve opens to the Pacific Ocean__no.0353, 2019. #CentralAmerica ",2019
354,"Honduras at Caribbean Sea coastline. The lagoon “Laguna de Los Micos” derives its name from the white-faced monkeys or “micos” which frequent the mangroves__no.0354, 2019  #CentralAmerica #mangroves",2019
355,"The James River in South Dakota may not drop below flood stage between October 2019 and the start of next year’s flood season__no.0355, 2019.  #flooding",2019
356,"The Gila River, here just north and east of Yuma, Arizona, is endangered from diminishing snowpack source water, increasing temperatures, and a proposed diversion project__no.0356, 2019.  #watershortage #risingtemperatures #waterdiversion",2019
357,"The new (2019) Calaveras Dam in California replaces the “seismically vulnerable 93-year old dam.” The reservoir, northeast of San Jose, will be the largest to serve the San Francisco area when full__no.0357, 2019.",2019
358,"Coyote Creek and salt ponds in south San Francisco Bay. Many salt ponds are slowly being converted to marsh land and buffer zones through the South Bay Salt Pond Restoration Project in coordination with Cargill (Salt)__no.0358, 2019. #California #saltponds",2019
359,"Deschutes River at Warm Springs Indian Reservation in Central Oregon, which has been without safe drinking water since a pipe broke 5 months ago (Spring 2019) affecting 4,000 people. Emergency bottled water distribution is underway__no.0359, 2019.  #potablewater ",2019
360,"Devil’s Lake in North Dakota at Fort Totten on Spirit Lake Reservation__no.0360, 2019. ",2019
361,"The Yamuna River at New Delhi, India, is a collection of 18 drains flowing into it, carrying a toxic cocktail of sewage, chemicals, detergents, and industrial waste. Less than 10% of sewage discharged into the river is treated. A froth of foam from the pollution makes for surreal photographs which belie the seriousness of the situation__no.0361, 2019.  #waterpollution #watercontamination #toxicwaters #toxicchemicals #publichealthrisk #industrialwaste",2019
362,"The Mississippi River makes a dramatic loop at New Madrid, Missouri, primary site of the New Madrid Seismic Zone, active periodically and considered the most dangerous earthquake region east of the Rockies. In the quake of 1811-12 the Mississippi was said to have flowed backwards__no.0362, 2019. ",2019
363,"On the Mississippi River, Memphis, Tennessee, sits atop the “Memphis aquifer” known to provide top quality drinking water. But there’s concern about the arsenic from coal ash permeating the clay barrier and contaminating the aquifer’s regional water supply layer below__no.0363, 2019.  #watercontamination",2019
364,"William Baker Oliver Lake looks more like a river, and runs just north of the NOAA National Water Center at the University of Alabama in Tuscaloosa. It is the first national water resources facility in the country and one of several locations for the NOAA Office of Water Prediction__no.0364, 2019.  #NOAA #NationalWaterCenter ",2019
365,"Reelfoot Lake in Tennessee was formed during earthquakes of 1811-12 at the New Madrid fault. Land sank and Mississippi waters created this shallow marsh and wildlife refuge__no.0365, 2019. #Tennessee #NewMadridfault",2019
366,"Indiana Dunes on Lake Michigan’s shore became the nation’s 61st National Park in February of 2019. Just 6 months later, steel company Arcelor Mittal spilled cyanide and ammonia into the lake. Hundreds of dead fish caused officials to close the beaches for days__no.0366, 2019. #GreatLakes #waterpollution #toxicspill",2019
367,"Unnamed configuration of creeks north of Lake Milton, south of Newton Falls, Ohio__no.0367, 2019.",2019
368,"The Prairie River joins the St Lawrence River north of Montreal, Canada__no.0368, 2019.",2019
369,"Winooski River at Lake Champlain, Vermont, north of Burlington__no.0369, 2019. #Vermont",2019
370,"Waters of “Lady Evelyn-Smoothwater Provincial Park,” Ontario, Canada, located in the heart of the Temagami region and center of 2400 kilometers (1400+ miles) of interconnected canoeing network, thousands of years old__no.0370, 2019. ",2019
371,"Thousands of egg-shaped balls of ice covered a beach in Finland. These “ice eggs” are a rare weather phenomenon, in which small pieces of ice roll over and over with winds and water affecting the shape and smooth surfaces_+no.0371, 2019.",2019
372,"The Susquehanna River, southeast of Harrisburg, Pennsylvania, surrounds the site of the Three Mile Island Nuclear Generating Station where reactor number 2 had a partial meltdown and leak in 1979. The plant closed down entirely in September, 2019__no.0372, 2019. #nuclearreactors #nuclearenergy",1979
373,"Colorado River at Gila River, Phoenix, Arizona__no.0373, 2019. ",2019
374,"Cape Cod Bay at Provincetown, Massachusetts__no.0374, 2019.",2019
375,"The drying Mother of Ducks Lagoon, Guyra, New South Wales, in Australia, where drought and water crisis have led to a new pipeline to a nearby dam so that water doesn’t have to be trucked in__no.0375, 2019. ",2019
376,"The Allegheny River and Monongahela River converge at Pittsburgh, Pennsylvania, to form the Ohio River. Monongahela is a Unami word meaning “falling banks.”__no.0376, 2019.",2019
377,"Colorado River in western Colorado, near the town of Antlers__no.0377, 2019. ",2019
378,"Sheffield Cove and Mackerel Cove, Jamestown, Rhode Island. The coves, divided by Beavertail Road, are popular quahogging locations__no.0378, 2019. #Eastcoast",2019
379,"Wareham River at Buzzard’s Bay near Onset and Cape Cod, Massachusetts__no.0379, 2019.  #Eastcoast",2019
380,"Lighthouse Beach at Edgartown, and Chappaquiddick Island, on Martha’s Vineyard, Massachusetts__no.0380, 2019.  #Eastcoast",2019
381,"Along Maine’s Atlantic coast Georgetown Island has more than 80 miles of shoreline__no.0381, 2019.  #Maine #Eastcoast ",2019
382,"East River at Onset, Wareham, Massachusetts, due east of Marc Anthony’s (pizza), and west of the Bourne Bridge to Cape Cod__no.0382, 2019. #Massachusetts #pizza",2019
383,"Eel Pond and waters at Woods Hole Oceanographic Institution, “the world’s largest, non-profit ocean science research and education institution,” in Woods Hole, Massachusetts, on Cape Cod__no.0383, 2019. #Eastcoast",2019
384,"Cape Cod’s “Sandy Neck Barnstable Harbor Area of Critical Environmental Concern” includes one of the largest barrier beach systems in New England. It includes extensive salt marsh habitat. This designation is an initiative of the Marine Conservation Institute headquartered in Seattle, Washington__no.0384, 2019.  #Massachusetts #CapeCod ",2019
385,"Venice, Italy, endures rains with historic flooding reflecting both sinking land and rising waters__no.0385, 2019.  #subsidence",2019
386,"Mississippi River at St. James, Louisiana, west of New Orleans. The sharp bend in the river provides a challenge to longer barge traffic on the river__no.0386, 2019. ",2019
387,"Gulf of Mexico waters just inland of Padre Island, south Texas__no.0387, 2019.",2019
388,"Yukon River, Alaska__no.0388, 2019.",2019
389,"Melting sea ice at Pond Inlet, Nunavut, Canada. Sea ice is important habitat for polar bears and seals….”Extraordinarily warm fall a big problem in Canadian Arctic”—The Canadian Press, November 24, 2019.__no.0389, 2019.  #climatechange",2019
390,"Kansas River east of Manhattan, Kansas__no.0390, 2019.",2019
391,"Unnamed river delta at the Celebes Sea, Tarakan, Indonesia__no.0391, 2019. ",2019
392,"Tai Lam Chung Reservoir in western Hong Kong region__no.0392, 2019.",2019
393,"Far western Russia’s Reka (River) Chelomdzha becomes Reka Tauy as it approaches the Sea of Okhotsk north of Japan__no.0393, 2019. #Russia",2019
394,"Cape Vankarem on Russia’s Northeast Chukchi Sea coast. The village of Vankarem’s population is 184.__no.0394, 2019.  #Russia",2019
395,"Point Hope is an Alaskan village high above the arctic circle where the Bering and Chukchi Seas meet. Ninety percent of the “spit” sticking out into the ocean has disappeared.  Point Hope is said to be the oldest continuously inhabited village in all of North America with over 2500 years of recorded history__no.0394, 2019. #Alaska #historicsite #risingwaters",2019
396,"The Diomede Islands are located in the middle of the Bering Strait between mainland Alaska and Siberia. They are separated by the international date line causing Big Diomede Island, owned by the Russians, to also be called “Tomorrow Island.”__no.0396, 2019.",2019
397,"The Magdalen Islands, a windswept archipelago in Canada’s Gulf of St. Lawrence used to be protected by ice. Now the island is “crumbling into the sea.”—October 1, 2019, Washington Post__no.0397, 2019.  #Canada  #climatechange",2019
398,"Kivalina, Alaska, is on alert for contaminants, lead, cadmium, mercury, etc., from the remote upstream Red Dog Mine, the world’s largest producer of zinc__no.0398, 2019. #toxicminerals #miningpollutants #watercontamination ",2019
399,"East of Alaska’s Togiak National Wildlife Refuge: Lake Chanekuktuli, Nuyakuk Lake, Lake Beverley, Lake Nerka, Lake Aleknagit, Lake Nunavagaluk__no.0399, 2019. #Alaska",2019
400,"Victoria Falls at the border of Zimbabwe and Zambia, is classified as the world’s largest waterfall, but after recent drought a climate change researcher told BBC that the disappearance of the falls was a “serious possibility.” December, 2019.__no.0400, 2019. #Africa #climatechange",2019
401,"Detroit River…A shoreline collapse into the river alarms residents as the site, upstream from an intake point, potentially consists of radioactive material from manufacture of uranium rods for The Manhattan Project (World War II era)…and first news reports came days later from a Canadian news source (not U.S.). Late November, 2019.__no.0401, 2019. #Michigan #watercontamination #radioactivecontamination",2019
402,"The Taku Glacier, immediately north of Juneau, Alaska, one of the world’s thickest glaciers, is now succumbing to global warming —Doyle Rice, USA Today, 11-8-2019.__no.0402, 2019.",2019
403,"Banana Island is on Lake Kariba, the largest man-made reservoir in the world, in Zambia, Africa. But Kariba Dam’s power generation has dropped as the Zambezi River basin faces major drought__no.0403, 2019.",2019
404,"Coastal waters Southeast of Brisbane, Queensland, Australia__no.0404, 2019.",2019
405,"The Wollondilly River feeds this large reservoir, Lake Burragorang to the west of Sydney, Australia. There have been massive bushfires in this region of New South Wales and beyond, surpassing previous records__no.0405, 2019.  #globalwarming",2019
406,"Kansas River east of Lawrence, Kansas__no.0406, 2019.",2019
407,"Confluence of the Snake and Buffalo Rivers at Moran, Wyoming, within Yellowstone National Park__no.0407, 2019. ",2019
408,"Todd River flows through Alice Springs, Northern Territory, Australia. But the river, in the center of the country, for the most part, is dry. The temperatures in this summer season are now frequently over 100 degrees Fahrenheit and setting records attributable to climate change__no.0408, 2019.",2019
409,"Melchior Islands, Antarctic Peninsula. The archipelago consists of Omega Island, Lambda Island, and Eta Island__no.0409, 2019. #Antarctica",2019
410,"Port Dolomite on Lake Huron’s northern shore, Michigan’s Upper Peninsula. (Dolomite is a magnesium-rich variation of limestone.)__no.0410, 2019. #Michigan #GreatLakes #LakeHuron",2019
411,"Sturgeon Bay, Lake Michigan, at Wilderness State Park on Michigan’s lower peninsula__no.0411, 2019.  #Michigan #GreatLakes",2019
412,"Oodnadatta, a South Australian outback town, has notoriously high summer temperatures, increasing with climate change. The region has occasional springs arising from the Great Artesian Basin, one of the largest underground fresh water reservoirs in the world__no.0412, 2019. #Australia",2019
413,"Waiska Bay on southeastern Lake Superior, at Michigan’s Upper Peninsula north coast__no.0413, 2019. #Michigan #GreatLakes",2019
414,"Allegheny River at the mouth of Oil Creek, in Oil City, Pennsylvania, known for its prominence in the initial exploration and development of the petroleum industry (1861).__no.0415, 2019.",2019
415,"St. Louis River, southwest of Duluth, Minnesota, on the border with WIsconsin__no.0415, 2019.",2019
416,"Mekong River at Mekong Delta at the East Vietnam Sea. Heavy dredging for sand along several delta rivers are affecting the ecology of the region. Most sand is being used by China for expanding infrastructure and land extension__no.0416, 2019. #MekongDelta #Asia",2019
417,"Dong Nai Biosphere Reserve, a UNESCO site in Dog Nai province in southeast Viet Nam. The plateaux of the central Vietnamese highlands give way to the Nam Bo Delta with mountains and lowland rivers, streams, scattered lakes, ponds and wetlands__no.0417, 2020. #VietNam #Asia",2020
418,"Lagoa do Araras (means Lagoon of the Macaws) is next to the Negro River, a major tributary to the Amazon, so named because the waters are dark (“black”) from decaying vegetation__no.0418, 2020. #Brazil #SouthAmerica",2020
419,"Rivers at Belem on the northern coast of Brazil, barely south of the equator, and part of the vast Amazon River delta region__no.0419, 2020. #SouthAmerica",2020
420,"Rivers Furo Santa Maria and Cupijo, southwest of Belem, State of Para, Brazil__no.0420, 2020. #SouthAmerica",2020
421,"Iriri River in State of Para, Brazil__no.0421, 2020. #SouthAmerica",2020
422,"Amazon River at Macapa, near the Atlantic. The Amazon accounts for about one-fifth of the world’s total river flow__no.0422, 2020.  #SouthAmerica #Brazil",2020
423,"Walden Pond, Concord, Massachusetts, two-year home of essayist, poet, and philosopher Henry David Thoreau, is a famous example of a “kettle hole” formed by retreating glaciers 10,000 - 12,000 years ago__no.0423, 2020.  ",2020
424,"California’s Monterey Bay shellfish are being threatened by rising ocean acidity at twice the rate of the global average, affecting coral, clams, mussels, and scallops. (new NOAA study)__no.0424, 2020.  #California #oceanacidification",2020
425,"The Platte River joins the Missouri River just north of Plattsmouth, Nebraska, where the wastewater treatment plant has been offline for 10 months since 2019 flooding, causing untreated sewage to directly enter the Missouri River__no.0425, 2020.  ",2019
426,"Peace River at Deep Creek between a phosphate mine and Punta Gorda, Florida__no.0426, 2020.  #GulfofMexico #waterrisk",2020
427,"The Runit Dome is a concrete structure at Runit Island (Enewetak Atoll) in the Pacific Marshall Islands. The 18 inch thick dome was built to seal in nuclear waste from atomic testing, but there is evidence that it’s failing as sea levels rise. The domed previously volcanic crater was not lined as this was intended as a temporary solution…in 1977.__no.0427, 2020.  #PacificOcean #risingwaters ",1977
428,"Southwest coast of “Middle Caicos,” Turks and Caicos Islands, a British overseas territory east of Cuba..an archipelago of 40 low-lying coral islands in the Atlantic Ocean, where, currently, unknown disease is threatening coral reefs__no.0428, 2020. #diseasedcoralreefs ",2020
429,"Southwest shoreline of “North Caicos,” Turks and Caicos Islands north of Haiti and the Dominican Republic in the Caribbean__no.0429, 2020.  ",2020
430,"The Jacui River flows into the Guaiba River at Porto Alegre, in southern Brazil__no.0430, 2020. #SouthAmerica ",2020
431,"Rio Parana de las Palmas river delta at Isla Lucia, north of Buenos Aires, Argentina__no.0431, 2020. #SouthAmerica",2020
432,"Mississippi River at the convergence with St. Francis River and near Tunica Lake, an oxbow, and Austin, Mississippi a once thriving shipping port__no.0432, 2020.",2020
433,"Waters near Sanderson Point, Lost Creek Township, Missouri, Mark Twain National Forest__no.0433, 2020.",2020
434,"Arkansas River southeast of Tulsa, Oklahoma__no.0434, 2020. ",2020
435,"Arkansas River northwest of Wichita. (Pronounced Ar-Kansas in Kansas.) “As groundwater levels have fallen in recent years, the river in parts of western Kansas is dry much of the time:”—KU/Kansas Geological Survey__no.0435, 2020. #Kansas #shrinkingaquifer",2020
436,"Lake Sequoyah Park, east of Fayetteville in Northwest Arkansas__no.0436, 2020.",2020
437,"Tonle Sap River in Cambodia originates in the vast Tonle Sap Lake, southeast Asia’s largest freshwater lake. The river feeds into the Mekong River at Phnom Penh, Cambodia’s capital, on it’s way to the massive and fragile delta region__no.0437, 2020. #Asia",2020
438,"Skiatook Lake on the Osage Reservation (also Osage County) northwest of Tulsa, Oklahoma, is a federally-operated U.S. reservoir popular for fishing and water recreation__no.0438, 2020. #reservations ",2020
439,"Quitobaquito Springs, within Organ Pipe Cactus National Monument in Arizona, the only naturally occurring source of fresh water for miles. Nearby, contractors at the border with Mexico are drilling into the ground and draining water from a nearby, rare desert aquifer in order to mix concrete to support a towering 30-foot barrier along the U.S/Mexico divide. (Feb. 2020)__no.0439, 2020.  #borderwall #aquifers",2020
440,"Waters at “Happy Hollow” on the St. Francis River in Mark Twain National Forest in southeast Missouri__no.0440, 2020.",2020
441,"Waters in the southeast region of Mark Twain National Forest in southeast Missouri__no.0441, 2020.",2020
442,"Lake Wimico and surrounding lands in the Florida Panhandle were purchased by conservationists, with Deepwater Horizon funds, serving to help protect the water quality of the highly productive Apalachicola River, Apalachicola Bay, and the Gulf of Mexico__no.0442. 2020.",2020
443,"Santa Rosa Sound at Santa Rosa Island near Fort Walton Beach, Florida__no.0443, 2020. #GulfofMexico #Floridapanhandle",2020
444,"Lakes east of Sandestin, Florida, on the shore of Choctawhatchee Bay and north of the Gulf of Mexico_no.0444, 2020. #Floridapanhandle",2020
445,"AZCentral.com: Dec. 27th, 2019: “Megafarms and deeper wells are draining the water beneath rural Arizona - quietly, irreversibly.” Ian James and Rob O’Dell, Arizona Republic…”Some areas of the state have dropped so much that the water likely won’t naturally recover in our lifetimes…The average well in the Gila Bend basin has dropped by 62 feet”__no.0445, 2020. #groundwater #waterlevels #aquifers #Southwest",2019
446,"“The Bingham Canyon Mine, the largest open pit (copper) mine in the United States, will generate water pollution in perpetuity from the mine’s waste rock piles. Mine operations have resulted in a plume of contaminated groundwater extending over 70 square miles…”—Earthworks__no.0446, 2020. #coppermining #coppermines #openpitmining #groundwatercontamination #toxicminerals #waterpollution #Utah",2020
447,"Mississippi’s Pascagoula River at the Gulf of Mexico. Known as “the singing river” the Pascagoula is the largest undammed river in the contiguous 48 states, with protections from various conservation agencies__no.0447, 2020. #Mississippi #GulfofMexico",2020
448,"Colorado River at the Little Colorado River confluence on the eastern edge of Grand Canyon National Park in Arizona. The 2020 Google Earth map showed the Little Colorado to be dry at and near the point of the confluence__no.0448, 2020. #Southwest",2020
449,"Antarctica’s Base Marambio on Seymour Island at a continental peninsula, measured temperatures above 20C (68F) for the first time on record on February 9, 2020.__no.0449, 2020. #Antarctica #risingtemperatures #climatechange",2020
450,"Scattered lakes and ponds east of Lakeland, Florida, echo the many parts of the state where the water table is close to the surface and the underlying rock, often limestone structure, is porous. This Tampa region is part of what is referred to as “sinkhole alley.”__no.0450, 2020. #sinkholes",2020
451,"Guantanamo Bay, southeastern coast, Cuba__no.0451, 2020.",2020
452,"Upper reaches of the Pascagoula River in Mississippi, including Peafield Bayou (just out of sight) and Sandy Bayou__no.0452, 2020.",2020
453,"Flooded Pearl River below Ross B. Barnett Reservoir, Jackson, Mississippi, Feb. 2020.__no.0453, 2020. ",2020
454,"Water channels in neighborhoods near Pascagoula, Mississippi__no.0454, 2020. #canals",2020
455,"Lake Pontchartrain and the shallow, brackish Lake Maurepas, north of the Mississippi River at New Orleans, are connected by Pass Manchac__no.0455, 2020. ",2020
456,"Beauregard Island in Bay des Ilettes south of New Orleans__no.0456, 2020.  #Mississippi Mississippidelta",2020
457,"River Thames at England’s Kew Gardens, The Royal Botanic Garden__no.0457, 2020. #England #Europe",2020
458,"Loch Lomond and The Trossachs National Park in southwest Scotland__no.0458, 2020. #Europe  ",2020
459,"Inlet at East Mersea, United Kingdom, at the North Sea. It leads north to Colchester and Colchester Castle__no.0459, 2020. #Europe",2020
460,"The Swale, a branch of the River Medway estuary, gives its name to the surrounding district south of the Thames estuary. Land on either side of The Swale is marshland with both salt marsh and freshwater aquatic vegetation that extends the length of the district__no.0460, 2020. #England #Europe",2020
