id,content,year
461,"Lower Lough Erne in Northern Ireland, near Derrygonnelly, Blaney and Killadeas. (“Lough” rhymes with “clock”… is “Lake.”)__no.0461, 2020. #Europe   ",2020
462,"Lakes shaped by the last Ice Age in County Cavan, Ireland__no.0462, 2020. ",2020
463,"River Yare west of Burgh Castle and Great Yarmouth on England’s east coast__no.0463, 2020.  #England #Europe",2020
464,"Uatuma River waters behind Balbina Dam, north of Manaus, Brazil…”the worst hydroelectric power plant in the world.”  As a result of the methane released from its vast reservoir proportional to its output, the Balbina Dam emits more greenhouse gases than most coal plants__no.0464, 2020.  #SouthAmerica",2020
465,"Gila River at Cottonwood Wash in southeast Arizona is one of the longest rivers in the west, but it’s now typically drained dry before getting halfway through its 500-mile voyage west to the Colorado River at Holbrook, Arizona__no.0465, 2020. #watershortage #Southwest",2020
466,"Little Colorado River at Holbrook, Arizona__no.0466, 2020. #Southwest",2020
467,"The San Pedro River is an unusual northward-flowing stream originating in the Sierra Manzanal Mountains about 10-15 miles south of the U.S./Mexico border south of Sierra Vista, Arizona…”The San Pedro River’s cottonwood-shaded corridor provides critical stopover habitat for millions of migrating birds each year.” (The Nature Conservancy)__no.0467, 2020.  #Southwest #birdmigration #criticalhabitat",2020
468,"Gila River in southeast Arizona, here at “Peck Wash” (“wash”: dry creek, stream bed, gulch, with seasonal flow after a rain)__no.0468, 2020. ",2020
469,"Missouri River west of Lewis and Clark Lake along the South Dakota/Nebraska border. The reservoir is impounded by Gavins Point Dam, managed by the Army Corps of Engineers__no.0469, 2020.",2020
470,"The Big Sioux River joins the Missouri River at Sioux City, Iowa, marking the border of the southeast corner of South Dakota with Iowa to the east and Nebraska to the south__no.0470, 2020. ",2020
471,"DeSoto Lake is an “oxbow lake,” formed by the nearby Missouri River north of Omaha, Nebraska__no.0471, 2020.",2020
472,"The Platte River and a designed waterside community east of Morse Bluff, Nebraska__no.0472, 2020.",2020
473,"Skull Creek enters Nebraska’s Platte River west of North Bend and Morse Bluff__no.0473, 2020.",2020
474,"Platte River east of Columbus Nebraska near Edholm. A French explorer named the river ‘Nebraskier’ after its Oto name meaning “flat river.” The French later applied the French word plate (meaning flat, and pronounced plat, or platte) to the river__no.0474, 2020.",2020
475,"Nebraska’s North Loup River and Middle Loup River meet up at Loup Junction State Wildlife Management Area near Cushing__no.0475, 2020.",2020
476,"The Platte River southwest of Kearney, Nebraska…”Shallow channels of water weave around sandy islands along the 310-mile course of the Platte River through Nebraska.”—NASA Earth Observatory, 2003.__no.0476. ",2003
477,"Missouri River at Bee Creek on the southern border of Weston Bend State Park in northwest Missouri__no.0477, 2020.",2020
478,"Nodaway River and unnamed tributary in northwest Missouri__no.0478, 2020.",2020
479,"Missouri River south of Williston, North Dakota. This region has seen a boom in oil and gas extraction activity to the north and south of the river. This is slowing as global prices decline__no.0479, 2020. #oilfields #BakkanFormation #WillistonBasin #oilboom #pollutionrisk",2020
480,"Missouri River at Lower Hamburg Bend Conservation Area, west of Hamburg, Iowa…one of many riverside regions affected by dramatic flooding in 2019.__no.0480, 2020. #MissouriRiverfloods",2019
481,"Big Blue River flooding at Blue Rapids, Kansas, 2019. The Big Blue feeds into Tuttle Creek Reservoir to the south supporting Manhattan, Kansas, and the surrounding region__no.0481, 2020.",2019
482,"The Yellowstone River flows into the Missouri River in northwest North Dakota__no.0482, 2020.",2020
483,"The Missouri River feeds agricultural enterprise southeast of Pierre, South Dakota__no.0483, 2020.",2020
484,"The Knife River meets the Missouri River at Stanton, North Dakota__no.0484, 2020.",2020
485,"Water configuration on Missouri River south of Bismarck, North Dakota__no.0485, 2020.",2020
486,"Tumen River at the intersection of North Korean, Chinese and Russian borders (!)__no.0486, 2020. #Asia #Riverintersection",2020
487,"Unnamed lake/reservoir in northern South Korea__no.0487, 2020.  #Asia",2020
488,"Planned waterside living near Doniphan, Nebraska, just south of the Platte River and of Grand Island. Neighborhood street names include Monument Drive, Leisure Drive, and Island Drive__no.0488, 2020.  #watersideliving",2020
489,"Lpsok reservoir in North Korea. Details unknown__no.0489, 2020. #Asia",2020
490,"Taedong River at Bukchang Concentration Camp in North Korea__no.0490, 2020. #Asia",2020
491,"Covid-19 virus. Stay-at-home orders start March 23rd, 2020__no.0491, 2020. #pandemic",2020
492,"River delta border between South Korea and North Korea, north of Seoul, South Korea__no.0492, 2020. #Asia",2020
493,"Nen River in northern China__no.0493, 2020.  #Asia",2020
494,"The Yangtze River delta at Shanghai, China, where waters flow into the Yellow Sea and the (contested) East China Sea, which is shared among the People’s Republic of China, Japan and South Korea__no.0494, 2020. #Asia",2020
495,"Sheshui River flows into the Yangtze River in Wuhan, China__no.0495, 2020. #Asia",2020
496,"Keti Bunder South Wildlife Sanctuary, slightly inland of the Gulf of Oman, south of Karachi, Pakistan__no.0496, 2020.",2020
497,"Sabarmati River, south of Ahmedabad, India….Headline, one year ago, April, 2019: “Sabarnati, the river that Gandhi once chose to live by is now dry and polluted.”  —mongabay.com  __no.0497, 2020.  #Asia #pollutedwaters #climatechange #waterdiversion #cleanwater",2019
498,"Brahmaputra River at the border of Bangladesh and East India__no.0498, 2020. #Asia",2020
499,"Waters of the Buriganga River are modified to support multiple brick-making facilities in western Dhaka, Bangladesh__no.0499, 2020. #Asia ",2020
500,"Upper Meghna River, in Bangladesh, Northeast of Dhaka…One of the three rivers that eventually form the Ganges Delta, the largest delta in the world, at the Bay of Bengal__no.0500, 2020. #Asia",2020
501,"Meghna River branches southwest of Faridganj, Bangladesh__no.0501, 2020. #Asia",2020
502,"Meghna River branches southeast of Dhaka, Bangladesh__no.0502, 2020. #Asia",2020
503,"Karnaphuli River forms Bangladesh’s largest lake and only hydroelectric power source at Kaptai Dam__no.0503, 2020. #Asia",2020
504,"Pashur River at Dhangmari, Bangladesh…”In Bangladesh and the neighboring Indian state of West Bengal, there are thousands of villages like East Dhangmari—places that are losing their natural defenses against climate change just as it is intensifying. The land is paper-flat and crisscrossed by rivers bulging with meltwater from the Himalaya. Cyclones frequently roar in off the Bay of Bengal, sometimes killing thousands. Flooding is pervasive.”—National Geographic, March 2020.__no.0504, 2020. #Asia #India",2020
505,"River TIber north of Rome, Italy__no.0505, 2020.  #Europe",2020
506,"Taranto, Italy, is called “the city of the two seas” with Mar Grande (Big Sea) the commercial port and Mar Piccolo ( Little Sea) the fishing and military port__no.0506, 2020. #Europe",2020
507,"Fiume Agri  (Agri River) in southern Italy__no.0507, 2020. #Europe",2020
508,"Yukon River in Yukon territory, near the Capstone Minto (copper-gold) Mine northeast of Whitehorse, Alaska__no.0508, 2020. #miningregion",2020
509,"Yukon River northwest of Whitehorse, Alaska, at the Ingersoll Islands__no.0509, 2020.",2020
510,"The Ionian Sea at Montegiordano Marina on the coast of southern Italy__no.0510, 2020. #Europe",2020
511,"Fiume Paglia near Monterubiaglio, Italy__no.0511, 2020. #Europe",2020
512,"Adriatic Sea at the port city of Brindisi in southern Italy, where primary trade is with Greece and the Middle East__no.0512, 2020.  #Europe",2020
513,"Trigno River at the confluence with Treste River, south of Vasto on Italy’s east coast__no.0513, 2020. #Europe",2020
514,"San Francisco Bay South Basin at Hunter’s Point Shipyard and Superfund site containing 100 cubic yards of the most toxic elements listed by the EPA__no.0514, 2020. #California #Pacificcoast #toxicmaterials",2020
515,"Sinni River and tributaries in southern Italy__no.0515, 2020. ",2020
516,"Magra River near Barbarasco in northern Italy_no.0516, 2020.  ",2020
517,"The Fiume Nica meets Torrente Acero in this picturesque region of southern Italy__no.0517, 2020. #Europe",2020
518,"Fiumara Amendolea (river) near Galliciano, Italy, on the edge of the Aspromonte Mountains and at the “toe” of the boot-shaped peninsula that is Italy!__no.0518, 2020. #Europe",2020
519,"Fiumara Alaca, southwest of Soverato Marina, Italy, on the Ionian Sea__no.0519, 2020. ",2020
520,"Po River near Cervesina, France, Lombardy region, southwest of Milan, Italy__no,0520, 2020. #Europe",2020
521,"Islands at the mouth of the North River in North Carolina, near the Rachel Carson Estuarine Reserve__no.0521, 2020. #Eastcoast #SilentSpring",2020
522,"Lower White Oak River in eastern North Carolina is an estuary environment rich in clams. This region allows for mechanical harvesting of clams during certain parts of the year__no.0522, 2020.  #Eastcoast ",2020
523,"Cape Fear River and Intracoastal Waterway near Southport, Delaware, at U.S. Atlantic coast__no.0523. 2020. #Eastcoast",2020
524,"Foster Creek feeds into the Wando River north of Mt. Pleasant, South Carolina__no.0524, 2020. #Eastcoast",2020
525,"The Little Pee Dee River meets the Great Pee Dee River in Waccamaw National Wildlife Refuge in South Carolina__no.0525, 2020. #Eastcoast  ",2020
526,"Blackbeard Creek in Georgia at the Atlantic Ocean__no.0526, 2020. #Eastcoast",2020
527,"Upper reaches of Blackbeard Creek in Georgia at Eulonia__no.0527, 2020. #Eastcoast",2020
528,"Tennessee River west of Florence, Alabama…to celebrate a native woman, a member of the Euchee (also “Yuchi”) Tribe in eastern Tennessee River Valley, who, with her people, was forced to follow the Trail of Tears to Oklahoma. She missed her home and her “singing river” and over five years she retraced her steps as the river sang her home to her birthplace… commemorated in “Singing River” by musician Linda McRae from her album “Going to the Well.”__no.0528, 2020. #NativeAmerican #SingingRiver #Home",2020
529,"In the Pacific there is an underwater mountain ridge extending from Hawaii to the northwest toward Japan. In May of 2020 came an announcement that Puhahonu, a volcano largely buried beneath ancient coral reefs, and part of this chain, is officially the world’s largest volcano based on new measurements of its way-below-sea-level base.. (Approx. 525 miles NW of Hawaii.) (13 Million years old). (Puhahonu means “turtle rising for breath” in Hawaiian.)__no.0529, 2020. #PacificOcean",2020
530,"Goose Lake in Moabi Regional Park, in Mojave County, Arizona, alongside the Colorado River at the Arizona/California border__no.0530, 2020. #Southwest",2020
531,"The Java Sea is slowly eating away at the island of Java in the multi-island nation of Indonesia. Java is sinking because of intense groundwater extraction, the destruction of mangroves and rising sea levels due to climate change__no.0531, 2020. #subsidence #groundwaterextractiion",2020
532,"Spring Valley Lake in the city of Roanoke, Virginia, is one of a series of small creek fed lakes. Heavy rains in late May, 2020, sparked fears that the dam would fail__no.0532, 2020.",2020
533,"Altamaha River, east of Madray Springs, Georgia__no.0533, 2020.",2020
534,"Altamaha River at Wolf Island National Wildlife Refuge (Georgia) on the Atlantic Ocean__no.0534, 2020. #Eastcoast",2020
535,"Upstream Oyster Creek between Bull River and South Channel Savannah River, at the Savannah, Georgia, shore__no.0535, 2020.  #Eastcoast",2020
536,"Norway’s Otta River at Lendbreen ice patch where melting ice has revealed more than 1,000 artifacts dating around 300 - 1500 A.D., telling the story of a mountain pass that served as a vital corridor for travel…NOTE: An ice patch, unlike a glacier, does not move, thus the artifacts are not damaged by shifts in ice layers__no.0536, 2020. #Norway #Europe #discovery",2020
537,"Tittabawassee River at Edenville Dam, Michigan: “Dam Failure Threatens a Dow Chemical Complex and Superfund Cleanup”—New York Times, Hiroko Tabuchi, May 20, 2020… “Floodwaters from two breached dams in Michigan on Wednesday flowed into a sprawling Dow chemical complex and threatened a vast Superfund toxic-cleanup site downriver, raising concerns of wider environmental fallout from the dam disaster and historic flooding… Over the years the Dow complex has manufactured a range of products including Saran Wrap, Styrofoam, Agent Orange and mustard gas. Over time, Dow released chemicals into the water, leading to dioxin contamination stretching more than 50 miles along the Tittabawassee and Saginaw Rivers and into Lake Huron.”__no.0537, 2020.#GreatLakes #watercontamination #waterpollution #toxicchemicals #Superfundsite #floodwaters #flooding ",2020
538,"Rivers south of Saginaw, Michigan, converge before flowing toward Lake Michigan. One of them, the Tittabawassee, carries flood waters exposed to landfill and Super Fund sites heavily laced with contaminants from Dow Chemical, headquartered upriver in Midland, Michigan. (May, 2020).__no.0538, 2020. ",2020
539,"Mississippi River at Angola, Louisiana, home of Louisiana State Penitentiary, the largest maximum security facility in the U.S., surrounded by water and swamp on 3 sides. Staff members live on site. It is named after the home country of the slaves who used to work the land in it’s plantation days__no.0540, 2020. ",2020
540,"Missouri River at Bee Creek, southern border of Weston Bend State Park at Weston, Missouri, in western Missouri__no.0540, 2020.",2020
541,"Unknown river at “roughly 850 miles East of Mexico City” in the Tabasco state where a newly discovered huge earthen platform dating back 3,000 years is the now the largest and oldest known Mayan monument. June 3, 2020…image derived from “a three-dimensional image of the ancient Maya Aguada Fenix site based on lidar, an aerial remote-sensing method.”__no.0541, 2020.  #archeology #Mayanculture",2020
542,"Gunnison River, south of Orchard City, Colorado…”This cluster of counties on Colorado’s Western Slope—along with three counties just across the border in eastern Utah—has warmed more than 2 degrees Celsius, double the global average. Spanning more than 30,000 square miles, it is the largest 2C hot spot in the Lower 48” a Washington Post analysis found. …”This giant climate hot spot is robbing the West of its water” by Juliet Eilperin, Aug. 7, 2020.__no.0542, 2020. #Colorado #Utah #globalwarming #watershortages",2020
543,"The Milne Ice Shelf is at the fringe of Ellesmore Island, in far northern Canada. “Canada’s last fully intact Arctic ice shelf has collapsed, losing more than 40% of its area in just two days at the end of July.”—Reuters, early August, 2020.__no.0543, 2020.  #icecollapse",2020
544,"Canals of Cape Coral, Florida, are fighting increasing algae and weed growth from runoff of lawn fertilizer rich in nutrients__no.0544, 2020.  #fertilizerrunoff #GulfofMexico",2020
545,"Dill Creek and marshland on James Island in Charleston, South Carolina where 3,100 gallons of diesel fuel was spilled into the marsh from an above-ground tank at the Plum Island Wastewater Treatment plant mid-August, 2020.__no.0545, 2020. #watercontamination #marshland",2020
546,"Badwater Basin in Death Valley, California is the lowest point in North America. On Sunday, August 16th, 2020, Death Valley had an unverified temperature of 130 degrees Fahrenheit, the hottest in the world since 1913 (134 degrees, also in Death Valley).__no.0546, 2020.  #Hot  #Heat",2020
547,"Amazon River at Macapa, Brazil, near the “delta,” though it is not a true delta region because the turbulent Atlantic carries most of the river’s sediment out to sea__no.0547, 2020. #SouthAmerica",2020
548,"Amazon River at Almeirim, Brazil, northernmost city in the state of Para, at the equator__no.0548, 2020. #SouthAmerica",2020
549,"Big Sioux River at the Iowa and South Dakota border, in the U.S.__no.0549, 2020. ",2020
550,"Maule River, downriver from Colbun Hydroelectric Dam and Power Plant, northeast of Linares, Chile, captures rainfall and melting snowpack from Andes mountains__no.0550, 2020. #SouthAmerica",2020
551,"Andelien River, here at the Pacific coast of Chile on The Bay of Concepcion__no.0551, 2020. #SouthAmerica ",2020
552,"Biobio River at Tricauco, in the Biobio region of Chile and south of the major city of Concepcion__no.0552. 2020. #SouthAmerica",2020
553,"Pacific waters off the coast of Chile in South America flow through the Guaitecas Archipelago of more than 40 islands and islets scattered between the Moraleda channel and the Pacific ocean. Blue whale and humpback whales have been spotted in nearby Corcovado National Park waters__no.0553, 2020.",2020
554,"Turner Lake is in northern Saskatchewan, Canada__no.0554. 2020.",2020
555,"Churchill Lake is a glacial lake at Buffalo Narrows in northwest Saskatchewan, Canada__no.0555, 2020.",2020
556,"Mississippi River lowlands on the Illinois side of the Illinois/Iowa border at Bellevue State Park Dyas Unit Campground__no.0556, 2020.",2020
557,"Mississippi River at Missouri’s Clarence Cannon National Wildlife Refuge, located in the floodplain of the river and home to waterfowl, wading birds, shorebirds and songbirds…near Annada, Missouri__no.0557, 2020. ",2020
558,"The Wapsipinicon River in Iowa, a tributary of the Mississippi River, drains a rural farming region of rolling hills and bluffs north of Waterloo and Cedar Rapids__no.0558, 2020.",2020
559,"Mississippi riverbottom on the Iowa side of the river, at Savanna, Illinois__no.0559, 2020.",2020
560,"Mississippi River at Guttenberg, Iowa__no.0560, 2020.",2020
561,"A cluster of “kettle lakes” west of Minneapolis, Minnesota. The Great Lakes and the lakes in Minnesota were formed as glaciers receded during the last ice age.  Approximately 15,000 years ago to about 9,000 years ago, glaciers alternately retreated and advanced over the landscape, carving out holes and leaving behind ice chunks…Lakes formed in this way are called kettle lakes__no.0561, 2020.  #kettlelakes #iceage",2020
562,"Nile River north of Dongola, Sudan, on the northeast African continent where yearly seasonal rains in the Ethiopian highlands prompt annual summer floods on the Nile River. But this cycle which can feed the agricultural needs of the Nile River basin has this year been devastating__no.0562, 2020. #NileRiver #flooding",2020
563,"The Crow River enters the Mississippi River at Dayton in south central Minnesota__no.0563, 2020.  ",2020
564,"Snake Hole Creek on Iona Island, Hudson River, New York. “Iona Island is one of the largest tidal wetlands along the Hudson, with about 270 acres of freshwater and brackish cattail marshes.”—Iona Island National Estuarine and Research Reserve, New York State Department of Environmental Conservation__no.0564, 2020. ",2020
565,"Sleepy Hollow Lake, Green County, New York, is both a recreational lake and residential community 120 miles north of New York City and 28 miles southeast of Albany in the Hudson River Valley__no.0565, 2020.",2020
566,"Missisquoi River empties into Lake Champlain’s Mississquoi Bay in far northwestern Vermont only a few miles south of the Canadian border__no.0566, 2020.",2020
567,"Delaware River at Callicoon Creek defines the New York/Pennsylvania state border__no.0567, 2020.",2020
568,"Missisquoi River at North Troy, Vermont__no.0568, 2020.",2020
569,"Soft Maple Reservoir, upstate New York__no.0569, 2020.",2020
570,"Soft Maple Reservoir, upstate New York__no.0570, 2020.",2020
571,"Republican River at Milford Reservoir, north central Kansas__no.0571, 2020.",2020
572,"Mexico’s Conchos River at Boquilla Tendida and Mijares. The region is particularly dry and farmers are protesting contractual (1944 Water Treaty) release of water at Conchos Reservoir into the river toward the Rio Grande and the U.S for U.S. agricultural irrigation purposes, as well as drinking water for both U.S. and Mexican communities. Conversely, Mexico is allowed an allotment from the Colorado River to the west__no.0572, 2020. #watertreaty #RioGrande #agriculturalirrigation ",1944
573,"Rio Conchos and La Boquilla Dam, southwest of Camarga, Mexico, in the Mexican state of Chihuahua. “Farmers hold out at seized Mexican dam as tensions build.”—AP, Sept. 11, 2020.__no.0573, 2020.  #waterconflict #waterrights",2020
574,"Smoky Hill River at Saline River northeast of Salina, Kansas__no.0574, 2020.",2020
575,"McKenzie River near Leaburg, Oregon, within the perimeter of the Holiday Farm Fire which stands at around 170,000 acres as of September 17, 2020, and estimated 10% containment__no.0575, 2020. ",2020
576,"Aydar Lake near Darvoza in eastern Uzbekistan__no.0576, 2020.  #Asia",2020
577,"Klamath River at Grouse Creek and Little Humbug Creek in northern California. Within the boundaries of the Slater Fire, September 21, 2020__no.0577, 2020. #wildfires #Slaterfire",2020
578,"Arkansas River at Greenleaf Creek and Arrowhead Point is within the Cherokee Nation, comprising approximately 7,000 square miles in northeast Oklahoma and now delineated on Google Maps.—CNN Leah Asmelash, September 23, 2020__no.0578, 2020. #CherokeeNation",2020
579,"Verdigris River at Oolagah Lake, Cherokee Nation, northeast Oklahoma__no.0579, 2020. #CherokeeNation",2020
580,"Tenkiller Ferry Lake’s northern reaches, Cherokee Nation, northeast Oklahoma__no.0580. 2020. #CherokeeNation",2020
581,"Kaw River at Mill Creek and Nelson Island, Shawnee, Kansas__no.0581, 2020.",2020
582,"Amazon River north of Santarem, Para, Brazil, and of the confluence with the Tapajos River, a major tributary of the Amazon__no.0582, 2020.",2020
583,"Brazil’s Aripuana River features, at one point, Lagoa Araua and Lagoa Jatuarana Grande (lakes) running parallel to the river on either side. The Aripuana River is a tributary of the Madeira River which meets the Amazon River just east of the major city of Manaus__no.0583, 2020.",2020
584,"Roosevelt River at Isla Novo Destino, an island which splits and shapes the river and is the site of river rapids, experienced by Theodore Roosevelt and his team while exploring the river in 1914. (“River of Doubt” by Candice Millard, 2005)__no.0584, 2020. #RooseveltRiver #RioTeodoro #Brazil #TeddyRoosevelt #Riverofdoubt ",1914
585,"River rapids on the Roosevelt River in Brazil, confronted by Teddy Roosevelt and entourage in 1914. This is just north of the confluence with Rio Madeiranha. Current maps show what appears to be a makeshift adjacent air strip__no.0585, 2020. #RooseveltRiver #Brazil #RiverofDoubt #TeddyRoosevelt",1914
586,"Wolf Creek near Burlington, Kansas, is dammed to create Coffey County Lake, providing the water for the Wolf Creek Nuclear Power Generating Station__no.0586, 2020. ",2020
587,"Roosevelt River below the confluence with Rio Capitao Cardioso, Brazil. (Intense river rapids.)__no.0587, 2020. ",2020
588,"The Tapajos River at Brazil’s village of Alter do Chao, known as the “Caribbean in Brazil.” Because of the crystalline waters of the Tapajos River, the nearby city of Santarem has more than 62 miles of natural beaches, the last such beaches before the Tapajos joins the earthy waters of the Amazon River north of Santarem__no.0588, 2020.",2020
589,"The glacial waters of Oregon’s Zigzag River provide habitat to migrating Chinook and Coho salmon, steelhead and cutthroat. Waters flow from nearby Mount Hood__no.0589, 2020.",2020
590,"Roosevelt River in the State of Mato Grosso in Brazil. (see “River of Doubt” by Candice Millard, 2005.)__no.0590, 2020. ",2005
591,"Santa Catalina Island, south of Los Angeles: L.A. Times, October 25, 2020—“How the Waters off Catalina became a DDT dumping ground” …Hundreds of tons of DDT-laced sludge were dumped each month between 1947 and 1961. The orange dot is the site of the dumping. The irregular orange shape closer to shore is an already existing Superfund Site, yet to be cleaned up__no.0591, 2020. #California #SantaCatalinaIsland #SuperfundSite#watercontamination #LATimes",2020
592,"Cache la Poudre River, east of the Continental Divide in Colorado, has been a popular rafting/kayaking river depending on the water levels…Northeast of Cameron Peak, within the the boundary of the massive Cameron Peak Fire, October 2020.__no.0592, 2020. ",2020
593,"Passaic River at Newark, New Jersey, where, as of late September 2020, 15,000 of 18,000 miles of aging lead service pipes on private land have been replaced, with more to go in pursuit of safer drinking water for the city’s residents…“Simply put, there are no safe levels of lead”—Erik Olson, senior strategic director for Health at the Natural Resource Defense Council (NRDC)__no.0593, 2020.  #leadpipes #safedrinkingwater #replacingleadpipes",2020
594,"Lena River, one of the largest rivers in the world, empties into the Laptev sea on the northern coast of Russia. The Lena Delta Reserve is the most extensive protected wilderness area in Russia. The mouths of the rivers remain frozen throughout the year as they lie beyond the Arctic Circle.__no.0594, 2020.",2020
